{"schema":"sundgren.ir/1","path":"latin1_cr.py","language":"python","producer":"sundgren-python-ast/1 CPython 3.14.4","source_sha256":"a2d5cc6cae32d9e10b82946071af8393095c2e764e911dc4a40796a8cfa7f5a8","newlines":"universal","nodes":[{"id":"latin1_cr.py","parent":null,"kind":"Module","span":{"start":{"byte":0,"line":1,"col":1},"end":{"byte":76,"line":5,"col":1}},"body_span":null,"name":null,"qualified_name":null,"lang":{"ast":"Module"}},{"id":"latin1_cr.py::<lambda>","parent":"latin1_cr.py","kind":"Closure","span":{"start":{"byte":40,"line":2,"col":15},"end":{"byte":51,"line":2,"col":26}},"body_span":null,"name":"<lambda>","qualified_name":"<lambda>","lang":{"ast":"Lambda"}},{"id":"latin1_cr.py::f","parent":"latin1_cr.py","kind":"Function","span":{"start":{"byte":52,"line":3,"col":1},"end":{"byte":75,"line":4,"col":15}},"body_span":{"start":{"byte":65,"line":4,"col":5},"end":{"byte":75,"line":4,"col":15}},"name":"f","qualified_name":"f","lang":{"ast":"FunctionDef"}}]}
