{"schema":"sundgren.ir/1","path":"shed/calc.py","language":"python","producer":"sundgren-python-ast/1 CPython 3.14.4","source_sha256":"f04d9ea2541e5f31a9574fad17eb3dd85abdd3d3adde0eb1adf100343bb0970d","newlines":"universal","nodes":[{"id":"shed/calc.py","parent":null,"kind":"Module","span":{"start":{"byte":0,"line":1,"col":1},"end":{"byte":252,"line":16,"col":1}},"body_span":null,"name":null,"qualified_name":null,"lang":{"ast":"Module"}},{"id":"shed/calc.py::add","parent":"shed/calc.py","kind":"Function","span":{"start":{"byte":15,"line":2,"col":1},"end":{"byte":46,"line":3,"col":17}},"body_span":{"start":{"byte":34,"line":3,"col":5},"end":{"byte":46,"line":3,"col":17}},"name":"add","qualified_name":"add","lang":{"ast":"FunctionDef"}},{"id":"shed/calc.py::divide","parent":"shed/calc.py","kind":"Function","span":{"start":{"byte":48,"line":5,"col":1},"end":{"byte":142,"line":8,"col":17}},"body_span":{"start":{"byte":70,"line":6,"col":5},"end":{"byte":142,"line":8,"col":17}},"name":"divide","qualified_name":"divide","lang":{"ast":"FunctionDef"}},{"id":"shed/calc.py::classify","parent":"shed/calc.py","kind":"Function","span":{"start":{"byte":144,"line":10,"col":1},"end":{"byte":251,"line":15,"col":17}},"body_span":{"start":{"byte":165,"line":11,"col":5},"end":{"byte":251,"line":15,"col":17}},"name":"classify","qualified_name":"classify","lang":{"ast":"FunctionDef"}}]}
