{"schema":"sundgren.ir/1","path":"tricky.py","language":"python","producer":"sundgren-python-ast/1 CPython 3.14.4","source_sha256":"275fa5b3452def8a05f110eb564e97848437b172d112f90c62e8ca946f6443cc","newlines":"universal","nodes":[{"id":"tricky.py","parent":null,"kind":"Module","span":{"start":{"byte":0,"line":1,"col":1},"end":{"byte":485,"line":32,"col":1}},"body_span":null,"name":null,"qualified_name":null,"lang":{"ast":"Module"}},{"id":"tricky.py::<lambda>","parent":"tricky.py","kind":"Closure","span":{"start":{"byte":78,"line":2,"col":20},"end":{"byte":89,"line":2,"col":31}},"body_span":null,"name":"<lambda>","qualified_name":"<lambda>","lang":{"ast":"Lambda"}},{"id":"tricky.py::decorated","parent":"tricky.py","kind":"Function","span":{"start":{"byte":93,"line":4,"col":1},"end":{"byte":188,"line":10,"col":13}},"body_span":{"start":{"byte":180,"line":10,"col":5},"end":{"byte":188,"line":10,"col":13}},"name":"decorated","qualified_name":"decorated","lang":{"ast":"FunctionDef"}},{"id":"tricky.py::<lambda>#1","parent":"tricky.py::decorated","kind":"Closure","span":{"start":{"byte":117,"line":7,"col":8},"end":{"byte":126,"line":7,"col":17}},"body_span":null,"name":"<lambda>","qualified_name":"<lambda>","lang":{"ast":"Lambda"}},{"id":"tricky.py::<lambda>#2","parent":"tricky.py::decorated","kind":"Closure","span":{"start":{"byte":145,"line":8,"col":17},"end":{"byte":156,"line":8,"col":28}},"body_span":null,"name":"<lambda>","qualified_name":"<lambda>","lang":{"ast":"Lambda"}},{"id":"tricky.py::C","parent":"tricky.py","kind":"Class","span":{"start":{"byte":192,"line":12,"col":1},"end":{"byte":456,"line":27,"col":19}},"body_span":null,"name":"C","qualified_name":"C","lang":{"ast":"ClassDef"}},{"id":"tricky.py::C.one","parent":"tricky.py::C","kind":"Function","span":{"start":{"byte":206,"line":13,"col":5},"end":{"byte":232,"line":13,"col":31}},"body_span":null,"name":"one","qualified_name":"C.one","lang":{"ast":"FunctionDef"}},{"id":"tricky.py::C.multi","parent":"tricky.py::C","kind":"Function","span":{"start":{"byte":240,"line":15,"col":5},"end":{"byte":345,"line":19,"col":21}},"body_span":{"start":{"byte":306,"line":18,"col":9},"end":{"byte":345,"line":19,"col":21}},"name":"multi","qualified_name":"C.multi","lang":{"ast":"FunctionDef"}},{"id":"tricky.py::C.multi.<locals>.inner","parent":"tricky.py::C.multi","kind":"Function","span":{"start":{"byte":306,"line":18,"col":9},"end":{"byte":323,"line":18,"col":26}},"body_span":null,"name":"inner","qualified_name":"C.multi.<locals>.inner","lang":{"ast":"FunctionDef"}},{"id":"tricky.py::C.x","parent":"tricky.py::C","kind":"Function","span":{"start":{"byte":353,"line":21,"col":5},"end":{"byte":398,"line":23,"col":17}},"body_span":{"start":{"byte":390,"line":23,"col":9},"end":{"byte":398,"line":23,"col":17}},"name":"x","qualified_name":"C.x","lang":{"ast":"FunctionDef"}},{"id":"tricky.py::C.x#1","parent":"tricky.py::C","kind":"Function","span":{"start":{"byte":406,"line":25,"col":5},"end":{"byte":456,"line":27,"col":19}},"body_span":{"start":{"byte":446,"line":27,"col":9},"end":{"byte":456,"line":27,"col":19}},"name":"x","qualified_name":"C.x","lang":{"ast":"FunctionDef"}},{"id":"tricky.py::<lambda>#3","parent":"tricky.py","kind":"Closure","span":{"start":{"byte":464,"line":29,"col":5},"end":{"byte":483,"line":31,"col":2}},"body_span":{"start":{"byte":479,"line":30,"col":5},"end":{"byte":483,"line":31,"col":2}},"name":"<lambda>","qualified_name":"<lambda>","lang":{"ast":"Lambda"}}]}
