{"schema":"sundgren.ir/1","path":"shed/__init__.py","language":"python","producer":"sundgren-python-ast/1 CPython 3.14.4","source_sha256":"e3b0c44298fc1c149afbf4c8996fb92427ae41e4649b934ca495991b7852b855","newlines":"universal","nodes":[{"id":"shed/__init__.py","parent":null,"kind":"Module","span":{"start":{"byte":0,"line":1,"col":1},"end":{"byte":0,"line":1,"col":1}},"body_span":null,"name":null,"qualified_name":null,"lang":{"ast":"Module"}}]}
