{"schema":"sundgren.ir/1","path":"m.py","language":"python","producer":"sundgren-python-ast/1 CPython 3.14.4","source_sha256":"121f5df05269822688ae541b58b5461cc00f8057ece4864d6d633cd81d455b71","newlines":"universal","nodes":[{"id":"m.py","parent":null,"kind":"Module","span":{"start":{"byte":0,"line":1,"col":1},"end":{"byte":106,"line":6,"col":1}},"body_span":null,"name":null,"qualified_name":null,"lang":{"ast":"Module"}},{"id":"m.py::outer","parent":"m.py","kind":"Function","span":{"start":{"byte":0,"line":1,"col":1},"end":{"byte":105,"line":5,"col":52}},"body_span":{"start":{"byte":18,"line":2,"col":5},"end":{"byte":105,"line":5,"col":52}},"name":"outer","qualified_name":"outer","lang":{"ast":"FunctionDef"}},{"id":"m.py::outer.<locals>.inner","parent":"m.py::outer","kind":"Function","span":{"start":{"byte":18,"line":2,"col":5},"end":{"byte":52,"line":3,"col":21}},"body_span":{"start":{"byte":40,"line":3,"col":9},"end":{"byte":52,"line":3,"col":21}},"name":"inner","qualified_name":"outer.<locals>.inner","lang":{"ast":"FunctionDef"}},{"id":"m.py::outer.<locals>.<lambda>","parent":"m.py::outer","kind":"Closure","span":{"start":{"byte":77,"line":5,"col":24},"end":{"byte":86,"line":5,"col":33}},"body_span":null,"name":"<lambda>","qualified_name":"outer.<locals>.<lambda>","lang":{"ast":"Lambda"}},{"id":"m.py::outer.<locals>.<lambda>#1","parent":"m.py::outer","kind":"Closure","span":{"start":{"byte":93,"line":5,"col":40},"end":{"byte":102,"line":5,"col":49}},"body_span":null,"name":"<lambda>","qualified_name":"outer.<locals>.<lambda>","lang":{"ast":"Lambda"}}]}
